{"contract":"strategy-example-page","schemaVersion":2,"requestId":"request-synthetic","asOf":"2026-10-14T08:00:00+00:00","data":{"items":[{"exampleId":"example-synthetic","strategyId":"strategy-synthetic","versionId":"published-version-synthetic","snapshotId":"aaaaaaaaaaaaaaaaaaaaaaaaaaaaaaaaaaaaaaaaaaaaaaaaaaaaaaaaaaaaaaaa","observationId":"observation-synthetic","association":"humanIllustrative","category":"decisionOnly","annotation":"Human illustration; producer matching is not asserted.","contentHash":"0ff7b7316b9bce5b7f33721651b7dd11309004f01c68aa0a005a4b07d1ae00bc","publicationSequence":3,"knownAtUtc":"2026-10-14T08:00:00+00:00"}],"nextCursor":null,"publicationWatermark":3,"snapshotCursor":"synthetic-actor-receipt"}}
